{
  "schema": "regelsuche.discovery-challenge-plan-source/v1",
  "portfolioId": "regelsuche-evaluator-backed-challenges-2026-07/v1",
  "claimPolicy": "EVALUATOR_BACKED_DOES_NOT_IMPLY_EXTERNAL_NOVELTY",
  "selectionPolicy": {
    "minimumAssessedClasses": 5,
    "minimumSelectedClasses": 2,
    "requireIndependentEvaluator": true,
    "requireFrozenSplitUnit": true,
    "requireInformationParityBaselines": true,
    "externalSearchVisibility": "POST_FORMATION_ONLY",
    "pilotEvidenceStatus": "DEVELOPMENT_ONLY"
  },
  "challenges": [
    {
      "challengeId": "rational-assumption-rewrites",
      "title": "Assumption-sensitive rational rewrite identities",
      "decision": "SELECTED_FOR_PREREGISTRATION",
      "complexityTier": "INTERMEDIATE",
      "mathematicalObject": "parameterized rational expression rewrite with explicit nonzero assumptions",
      "candidateRepresentation": "directed AST pattern pair plus normalized assumption predicates",
      "formationInformation": [
        "untargeted expression seeds",
        "primitive semantics-preserving rewrite inventory",
        "domain and resource budgets"
      ],
      "prohibitedFormationInformation": [
        "expected target expression",
        "hidden reference rule",
        "final TEST denominator topology",
        "literature or CAS match"
      ],
      "independentEvaluator": {
        "evaluatorId": "rational-cross-multiplication-and-counterexamples/v1",
        "method": "cross-multiply under declared nonzero denominators, compare exact polynomial normal forms, and search bounded rational counterexamples",
        "resultStrength": "SYMBOLIC_IDENTITY_UNDER_EXPLICIT_ASSUMPTIONS",
        "unsupportedBoundary": "transcendental functions, undeclared branch cuts, or assumptions not expressible in the normalized predicate language"
      },
      "certificateRoute": "solver-neutral obligation with denominator assumptions and retained symbolic result",
      "splitUnit": "denominator-factor topology and normalized placeholder-incidence signature",
      "leakageControls": [
        "exact canonical fingerprint isolation",
        "alpha-normalized pattern isolation",
        "denominator-topology isolation",
        "post-formation external search only"
      ],
      "baselineProfiles": [
        "grammar-enumerative-assumption-aware",
        "random-valid-rational-pattern",
        "validation-only-CAS-separate-track"
      ],
      "multipleSolutionPolicy": "credit every distinct valid normalized rule; do not require equality with a hidden reference",
      "nullResultPolicy": "retain zero-output, refuted, unsupported, timeout, and incomplete-assumption outcomes",
      "budget": {
        "maximumCampaigns": 24,
        "maximumStatesPerCampaign": 2000,
        "maximumCandidateEvaluations": 500,
        "maximumCounterexampleAttempts": 1000,
        "maximumProofAttempts": 100
      },
      "externalReviewSources": [
        "computer-algebra rule libraries",
        "formula and theorem databases",
        "mathematical literature indexes"
      ],
      "pilotRequirement": "verify denominator-assumption propagation and false-positive rejection on development-only examples",
      "selectionRationale": "extends beyond coefficient collection while retaining exact symbolic evaluation and explicit side-condition failure modes"
    },
    {
      "challengeId": "finite-difference-recurrences",
      "title": "Finite-difference and recurrence hypotheses for integer sequences",
      "decision": "SELECTED_FOR_PREREGISTRATION",
      "complexityTier": "INTERMEDIATE",
      "mathematicalObject": "integer sequence prefix with a separate continuation holdout",
      "candidateRepresentation": "normalized finite-difference polynomial or bounded recurrence with declared order and assumptions",
      "formationInformation": [
        "observed TRAIN prefix",
        "sequence-domain generator contracts",
        "order and resource bounds"
      ],
      "prohibitedFormationInformation": [
        "final TEST continuation",
        "sequence database identifier",
        "post-hoc family label",
        "expected recurrence"
      ],
      "independentEvaluator": {
        "evaluatorId": "finite-sequence-holdout-and-recurrence-check/v1",
        "method": "evaluate the frozen recurrence on held-out terms and verify finite-difference or recurrence consistency over the declared finite domain",
        "resultStrength": "FINITE_DATA_VALIDATION_CERTIFICATE",
        "unsupportedBoundary": "does not prove uniqueness of an infinite sequence or external novelty"
      },
      "certificateRoute": "domain-specific finite-data witness plus optional solver obligation for the recurrence relation",
      "splitUnit": "recurrence-order, coefficient-shape, and finite-difference-signature family",
      "leakageControls": [
        "observed/holdout separation",
        "family and structural-signature isolation",
        "database lookup after candidate freeze only",
        "ambiguous continuation retained explicitly"
      ],
      "baselineProfiles": [
        "bounded-polynomial-interpolation",
        "minimum-description-recurrence-enumerator",
        "random-valid-recurrence"
      ],
      "multipleSolutionPolicy": "retain all valid hypotheses and score coverage, simplicity, and ambiguity separately",
      "nullResultPolicy": "retain no-fit, multiple-fit, unsupported-order, timeout, and failed-holdout outcomes",
      "budget": {
        "maximumCampaigns": 30,
        "maximumStatesPerCampaign": 1500,
        "maximumCandidateEvaluations": 600,
        "maximumCounterexampleAttempts": 600,
        "maximumProofAttempts": 60
      },
      "externalReviewSources": [
        "integer sequence databases",
        "recurrence literature",
        "symbolic sequence packages"
      ],
      "pilotRequirement": "characterize ambiguous finite prefixes and ensure no unique-infinite-sequence claim is emitted",
      "selectionRationale": "uses a distinct mathematical object type with a cheap holdout evaluator and explicit ambiguity semantics"
    },
    {
      "challengeId": "reusable-search-macros",
      "title": "Reusable symbolic macro and search-strategy discovery",
      "decision": "SELECTED_FOR_PREREGISTRATION",
      "complexityTier": "INTERMEDIATE",
      "mathematicalObject": "bounded composition of semantics-preserving transformations reused across frozen task families",
      "candidateRepresentation": "versioned macro operator with ordered primitive steps, applicability guards, and assumptions",
      "formationInformation": [
        "untargeted search trajectories",
        "primitive transformation inventory",
        "TRAIN-only structural telemetry"
      ],
      "prohibitedFormationInformation": [
        "final TEST targets",
        "qualification outcomes",
        "post-hoc success labels",
        "hidden macro reference"
      ],
      "independentEvaluator": {
        "evaluatorId": "paired-held-out-macro-utility/v1",
        "method": "verify every primitive step and compare baseline versus macro-enabled search under identical held-out inputs, targets, inventory, strategy, and budgets",
        "resultStrength": "DERIVATION_TRACE_AND_PAIRED_SEARCH_UTILITY",
        "unsupportedBoundary": "utility is not truth, novelty, or mathematical importance"
      },
      "certificateRoute": "replayable derivation trace plus paired utility and regression report",
      "splitUnit": "transformation motif, source family, and macro-structure signature",
      "leakageControls": [
        "family-disjoint held-out tasks",
        "macro formation without TEST targets",
        "exact and alpha-normalized step-sequence isolation",
        "paired information parity"
      ],
      "baselineProfiles": [
        "primitive-inventory-only",
        "random-valid-macro",
        "frequency-ranked-path-macro"
      ],
      "multipleSolutionPolicy": "compare every valid macro independently; equivalent step sequences share one normalized identity",
      "nullResultPolicy": "retain no-macro, no-gain, trade-off, regression, timeout, and unsupported-task outcomes",
      "budget": {
        "maximumCampaigns": 24,
        "maximumStatesPerCampaign": 3000,
        "maximumCandidateEvaluations": 400,
        "maximumCounterexampleAttempts": 400,
        "maximumProofAttempts": 100
      },
      "externalReviewSources": [
        "term-rewriting strategy literature",
        "equality-saturation and macro-rewrite systems",
        "symbolic simplification benchmarks"
      ],
      "pilotRequirement": "measure candidate volume and duplicate collapse while preserving exact primitive-step provenance",
      "selectionRationale": "offers a systems-level discovery target with directly measurable reusable utility and independently checkable step semantics"
    },
    {
      "challengeId": "sign-sensitive-inequality-rewrites",
      "title": "Sign-sensitive inequality-preserving transformations",
      "decision": "DEFERRED_AFTER_PILOT",
      "complexityTier": "ADVANCED",
      "mathematicalObject": "parameterized inequality transformation with sign and domain conditions",
      "candidateRepresentation": "directed relation pattern, comparison-direction effect, and normalized sign assumptions",
      "formationInformation": [
        "untargeted inequality seeds",
        "primitive inequality transformations",
        "TRAIN-only sign-context telemetry"
      ],
      "prohibitedFormationInformation": [
        "final TEST sign assignments",
        "hidden reference transformation",
        "expected comparison direction"
      ],
      "independentEvaluator": {
        "evaluatorId": "inequality-smt-and-rational-counterexamples/v1",
        "method": "translate supported polynomial inequalities and assumptions to the solver-neutral IR, request refutation or confirmation, and search bounded rational counterexamples",